Titol;link
Ordenança de circulació de vianants i de vehicles;https://ajuntament.barcelona.cat/norma-portal-juridic/#vid/circulacio-vianants-i-vehicles-840951923
Ordenança de mesures per fomentar i garantir la convivència ciutadana a l'espai públic de Barcelona;https://ajuntament.barcelona.cat/norma-portal-juridic/#vid/mesures-per-fomentar-i-840952049
Ordenança d’establiments i centres de comerç alimentari de Barcelona;https://ajuntament.barcelona.cat/norma-portal-juridic/#vid/establiments-i-centres-comerc-840952124
Ordenança del medi ambient de Barcelona;https://ajuntament.barcelona.cat/norma-portal-juridic/#vid/medi-ambient-barcelona-840951883
Ordenança de Terrasses;https://ajuntament.barcelona.cat/norma-portal-juridic/#vid/terrasses-840951888
Ordenança de protecció, tinència i venda d'animals;https://ajuntament.barcelona.cat/norma-portal-juridic/#vid/proteccio-tinenca-i-venda-840952021
Ordenança municipal de les activitats i dels establiments de concurrència pública de Barcelona ;https://ajuntament.barcelona.cat/norma-portal-juridic/#vid/activitats-i-establiments-concurrencia-840952006
Ordenança sobre l’ús de les vies i els espais públics;https://ajuntament.barcelona.cat/norma-portal-juridic/#vid/us-vies-i-els-840952155